{
  "signal_id": "sig_poison_empty_lineage",
  "niche_id": "camping-fixture",
  "signal_type": "demand",
  "source": {"domain": "example.com", "tier": "open"},
  "window": {"from": "2026-01-01T00:00:00Z", "to": "2026-07-01T00:00:00Z"},
  "normalized_score": 0.5,
  "confidence": 0.5,
  "observed_at": "2026-07-21T12:00:00Z",
  "expires_at": "2026-09-21T12:00:00Z",
  "derived_from": [],
  "provenance": {
    "code_version": "normalize-1.0.0",
    "schema_version": "signal.v1",
    "config_hash": "sha256:aaaaaaaaaaaaaaaaaaaaaaaaaaaaaaaaaaaaaaaaaaaaaaaaaaaaaaaaaaaaaaaa",
    "created_at": "2026-07-21T12:00:00Z"
  },
  "schema_version": "signal.v1"
}
